fecha_hora,sector,ubicacion,colonia,observaciones,clasificacion,causa,lesionados,fallecidos,vehiculos_cantidad
2015-06-26 12:08:00,"SUR 2","AV. UNIVERSIDAD Y CALLE ABARROTES","PRADOS DEL ORIENTE",,"CHOQUE","VUELTA INDEBIDA",0,0,2
2015-06-26 12:57:00,"CENTRO 2DO CUADRO","AV. MORELOS Y CALLE GARCIA CARRILLO","CENTRO","LESIONADO ******","CHOQUE","NO RESPETAR SEÑAL ALTO",0,0,2
2015-06-26 16:33:00,"CENTRO 4TO CUADRO","BLV. CONSTITUCION Y CALLE SALVADOR CREEL","NUEVA LOS ANGELES",,"CHOQUE","CORTE CIRCULACION",0,0,2
2015-06-26 16:51:00,"SUR 2","CARRETERA TORR-MAT A LA ALTURA DEL PUENTE LA JOYA","EJIDO EL AGUILA","LE DIERON LA ATENCION A UNA PERSONA DEL BATALLON Y NO ACUDIERON A ATENDERLO NI ESTATAL NI FEDERAL","CHOQUE","NO RESPETAR DISTANCIA",0,0,3
2015-06-26 16:52:00,"ORIENTE 1","BLVD. DIAGONAL REFORMA Y CALLE CHALCAS","SANTA MARIA",,"CHOQUE","NO RESPETAR DISTANCIA",0,0,2
2015-06-26 17:30:00,"ORIENTE 1","CARRETERA ANTIGUA A SAN PEDRO FRENTE A LA COCA-COLA","ZONA INDUSTRIAL",,"CHOQUE","CORTE CIRCULACION",0,0,2
2015-06-26 18:31:00,"SUR 2","PASEO DEL TECNOLOGICO FRENTE A BODEGA AURRERA","MONTERREAL",,"CHOQUE","CORTE CIRCULACION",0,0,2
2015-06-26 18:45:00,"ORIENTE 1","CALLE SAN FERNANDO Y CALLE SAN CARLOS","NUEVA CALIFORNIA",,"CHOQUE","NO RESPETAR DISTANCIA",0,0,2
2015-06-26 19:12:00,"CENTRO 2DO CUADRO","AV. PRESIDENTE CARRANZA Y  CALLE MARIANO LOPEZ ORTIZ","CENTRO",,"CHOQUE","NO RESPETAR SEÑAL ALTO",0,0,2
2015-06-27 03:00:00,"ORIENTE 1","CALZ. RAMON MENDEZ Y AV. OCAMPO","NUEVO TORREON","TURNO NOCTURNO","CHOQUE","CORTE CIRCULACION",0,0,2
2015-06-27 06:00:00,"SUR 2","CALLE VENECIA Y CALLE PRAGA","TORREON RESIDENCIAL","TURNO NOCTURNO","CHOQUE","CORTE CIRCULACION",0,0,2
2015-06-27 08:08:00,"ORIENTE 1","BRAVO ANTES DE LLEGAR AL PERIFERICO","LAS LOMAS","EL RESPONSABLE SE DIO A LA FUGA, IBA HABLANDO POR CELULAR","ATROPELLADO CICLISTA","PERDIDA CONTROL",1,0,2
2015-06-27 09:10:00,"SUR 1","BLVD. REVOLUCION Y CALLE JAZMINEZ","TORREON JARDIN",,"CHOQUE","NO RESPETAR SEÑAL ALTO",2,0,2
2015-06-27 09:20:00,"CENTRO 1ER CUADRO","AV. MATAMOROS Y CALLE FALCON","CENTRO",,"CHOQUE","NO RESPETAR SEÑAL ALTO",0,0,2
2015-06-27 09:30:00,"CENTRO 1ER CUADRO","AV. ALLENDE Y CALLE ILDEFONSO FUENTES","CENTRO",,"ATROPELLADO CICLISTA","SENTIDO CONTRARIO",1,0,2
2015-06-27 11:05:00,"SUR 2","AV. PAVO REAL Y CALLE GAVIOTAS","RINCON AURORA","51 CON LA UNIDAD 3594 DE PAPA ","CHOQUE","CORTE CIRCULACION",0,0,2
2015-06-27 12:45:00,"CENTRO 1ER CUADRO","AV. PRESIDENTE CARRANZA Y CALLE MUZQUIZ","CENTRO",,"CHOQUE","CORTE CIRCULACION",0,0,2
2015-06-27 13:30:00,"CENTRO 2DO CUADRO","BLVD. INDEPEPNDENCIA Y AV. ZACATECAS","CENTRO",,"CHOQUE","NO RESPETAR DISTANCIA",0,0,2
2015-06-27 13:40:00,"CENTRO 1ER CUADRO","AV. MATAMOROS Y CALLE GALEANA","CENTRO",,"CHOQUE","NO RESPETAR DISTANCIA",0,0,2
2015-06-27 14:20:00,"ORIENTE 1","CALZ. AVILA CAMACHO Y CALZ. ABASTOS","SANTA MARIA","PENDIENTE DATOS","CHOQUE","CORTE CIRCULACION",0,0,0
2015-06-27 14:44:00,"CENTRO 3ER CUADRO","AV. OCAMPO Y CALLE 26","CENTRO",,"CHOQUE","PERDIDA CONTROL",1,0,3
2015-06-27 15:53:00,"CENTRO 1ER CUADRO","AV. HIDALGO Y CALLE FALCON","CENTRO","PERSONA EN SILLA DE RUEDAS CRUZA EL SEMAFORO EN ROJO","ATROPELLADO PEATON","PERDIDA CONTROL",1,0,1
2015-06-27 16:20:00,"ORIENTE 1","ANTIGUA CARRETERA SAN PEDRO ","EJIDO PASO DEL AGUILA","CONDUCTOR SE QUEDO DORMIDO, SE SUBIO AL CAMELLON","CHOQUE","PERDIDA CONTROL",0,0,1
2015-06-27 17:14:00,"SUR 2","BLVD. REVOLUCION Y CALLE TURIN","EX-HACIENDA LOS ANGELES","SE LE ATRAVESO UN PERRO, PERDIO EL CONTROL","CHOQUE","PERDIDA CONTROL",0,0,1
2015-06-27 17:56:00,"SUR 1","CALLE FRANCISCO MUJICA Y CALLE EPIFANIO ZUÑIGA","LAZARO CARDENAS",,"VOLCADURA","EBRIEDAD",2,0,2
2015-06-27 18:33:00,"CENTRO 2DO CUADRO","BLVD. REVOLUCION Y CALLE COMONFORT","CENTRO",,"CHOQUE","NO RESPETAR DISTANCIA",0,0,3
2015-06-28 00:00:00,"SUR 1","PASEO DE LA ROSITA Y PASEO DE LA HUERTA","CAMPESTRE LA ROSITA","NO DEJO DATOS DE LOS RESPONSABLES NI DE LOS VEHICULOS","CHOQUE","EXCESO DE VELOCIDAD",0,0,2
2015-06-28 00:00:00,"ORIENTE 1","CALZ. CUITLAHUAC Y CALZ. ABASTOS","ABASTOS","NO DEJO DATOS DE LOS RESPONSABLES NI DE LOS VEHICULOS","CHOQUE","CORTE CIRCULACION",0,0,2
2015-06-28 00:00:00,"ORIENTE 1","RIO FLORIDO Y RIO FUERTE","MAGDALENAS","NO DEJO DATOS DE LOS RESPONSABLES NI DE LOS VEHICULOS","ATROPELLADO PEATON","EXCESO DE VELOCIDAD",0,0,1
2015-06-28 00:00:00,"CENTRO 4TO CUADRO","BLVD. CONSTITUCION Y RAMOS ARIZPE","MODERNA","NO DEJO DATOS DE LOS RESPONSABLES NI DE LOS VEHICULOS","CHOQUE","NO RESPETAR DISTANCIA",0,0,2
2015-06-28 00:00:00,"ORIENTE 2","CARRETERA TORREON MATAMOROS Y BLVD. LIBERTAD","CD NAZAS","NO DEJO DATOS DE LOS RESPONSABLES NI DE LOS VEHICULOS","CHOQUE","EXCESO DE VELOCIDAD",0,0,2
2015-06-28 00:00:00,"CENTRO 2DO CUADRO","BLVD. INDEPENDENCIA Y CALZ. CUAUHTEMOC","CENTRO","NO DEJO DATOS DE LOS RESPONSABLES NI DE LOS VEHICULOS","CHOQUE","CORTE CIRCULACION",0,0,2
2015-06-28 07:10:00,"ORIENTE 1","AV. MEXICO Y AV. ALLENDE","VILLA CALIFORNIA","EL CONDUCTOR  HUYO DEL LUGAR","CHOQUE","PERDIDA CONTROL",0,0,1
2015-06-28 09:00:00,"CENTRO 2DO CUADRO","CALZ. CUAUHTEMOC Y AV. ARISTA","CENTRO","CHOQUE CONTRA UN POSTE DE CFE","CHOQUE","EXCESO DE VELOCIDAD",1,0,1
2015-06-28 11:50:00,"ORIENTE 1","BLVD. INDEPENDENCIA ENTRE RIO NAZAS Y RIO LERMA","NAVARRO","CHOQUE CONTRA LA PUERTA DE PASTELERIA LETYS","CHOQUE","PERDIDA CONTROL",0,0,1
2015-06-28 12:40:00,"ORIENTE 1","CALZ. AVILA CAMACHO Y AZTLAN","BOCANEGRA","SE LE INDICO FORMA DE PROCEDER A AFECTADO YA QUE EL RESPONSABLE SE DIO A LA HUIDA","CHOQUE","PERDIDA CONTROL",0,0,2
2015-06-28 18:36:00,"CENTRO 4TO CUADRO","BLVD. CONSTITUCION Y CALLE FELICIANO COBIAN","AMPL. LOS ANGELES","CHOCA CONTRA CAMELLON","CHOQUE","PERDIDA CONTROL",0,0,1
2015-06-28 20:37:00,"CENTRO 4TO CUADRO","BLVD. RIO NAZAS Y CALLE FELICIANO COBIAN","AMPL. LOS ANGELES",,"CHOQUE","SEMAFORO",0,0,2
2015-06-28 21:05:00,"CENTRO 4TO CUADRO","PERIFERICO A LA ALTURA DE LA PUERTA AMARILLA","PERIFERICO",,"CHOQUE","PERDIDA CONTROL",0,0,2
2015-06-28 23:30:00,"CENTRO 2DO CUADRO","BLVD. REVOLUCION Y CALLE GARCIA CARRILLO","CENTRO","EL RESPONSABLE SE DIO A LA HUIDA","CHOQUE","NO RESPETAR DISTANCIA",0,0,2
2015-06-29 04:50:00,"ORIENTE 1","CALZ. MEXICO Y BLVD. FRANCISCO SARABIA","AVIACION",,"CHOQUE","EBRIEDAD",0,0,1
2015-06-29 08:23:00,"SUR 2","CALLE VENEZUELA Y CALLE GILBERTO RODRIGUEZ","LATINOAMERICANO",,"CHOQUE","NO RESPETAR SEÑAL ALTO",0,0,2
2015-06-29 09:08:00,"CENTRO 3ER CUADRO","BLVD. REVOLUCION Y CALLE JUAMBELZ","CENTRO",,"CHOQUE","NO RESPETAR DISTANCIA",0,0,2
2015-06-29 13:34:00,"CENTRO 2DO CUADRO","AV. MATAMOROS Y CALLE COMONFORT","CENTRO",,"CHOQUE","CORTE CIRCULACION",0,0,0
2015-06-29 13:47:00,"CENTRO 2DO CUADRO","AV. ABASOLO Y CALLE COMONFORT","CENTRO",,"CHOQUE","CORTE CIRCULACION",0,0,0
2015-06-29 14:24:00,"CENTRO 4TO CUADRO","PERIFERICO A LA ALTURA PUENTE LA UNION","LAGUNA NORTE",,"CHOQUE","NO RESPETAR DISTANCIA",0,0,2
2015-06-29 14:51:00,"CENTRO 3ER CUADRO","AV. JUAREZ Y CALZ. CUAUHTEMOC","CENTRO",,"CHOQUE","CORTE CIRCULACION",0,0,2
2015-06-29 16:47:00,"SUR 1","BLVD. DIAGONAL DE LAS FUENTES Y CALLE EMILIANO ZAPATA","LA MERCED",,"CHOQUE","CORTE CIRCULACION",1,0,2
2015-06-29 16:56:00,"CENTRO 2DO CUADRO","AV. GOMEZ FARIAS Y CALLE 12","CENTRO",,"CHOQUE","CORTE CIRCULACION",0,0,2
2015-06-29 17:18:00,"CENTRO 4TO CUADRO","BLVD. CONSTITUCION Y CALZ. SALVADOR CREEL (ESTACIONAMIENTO DE SORIANA)","AMPLIACION MARGARITAS",,"CHOQUE","NO RESPETAR DISTANCIA",0,0,0
2015-06-29 17:20:00,"ORIENTE 1","BLVD. JUAN PABLO II AFUERA DEL BOSQUE URBANO ","LAS ETNIAS",,"CHOQUE","EXCESO DE VELOCIDAD",0,0,1
2015-06-29 18:49:00,"ORIENTE 1","BLVD. REVOLUCION Y CALZ. MEXICO","FELIPE ANGELES",,"CARAMBOLA","NO RESPETAR DISTANCIA",0,0,3
2015-06-29 20:24:00,"CENTRO 4TO CUADRO","BLVD. CONSTITUCION Y CALLE AMADOR CARDENAS","AMPLIACION MARGARITAS",,"CHOQUE","NO RESPETAR SEÑAL ALTO",1,0,2
2015-06-30 07:34:00,"SUR 2","CALLE NAPO Y BOLIVAR"," MERCED II",,"CHOQUE","NO RESPETAR SEÑAL ALTO",0,0,2
2015-06-30 09:27:00,"CENTRO 2DO CUADRO","CALLE DEGOLLADO Y AV. ALLENDE","CENTRO",,"CHOQUE","ABRIR PUERTA",0,0,2
2015-06-30 09:31:00,"SUR 2","BLVD. RODRIGUEZ TRIANA Y BLVD. FRANCISCO SARABIA","CLUB BRITANIA",,"CHOQUE","NO RESPETAR DISTANCIA",0,0,2
2015-06-30 09:40:00,"SUR 1","BLVD. LAGUNA SUR Y CALLE 11a","BRAULIO FERNANDEZ AGUIRRE","TRAILER DERRIBO UN CABLE DE LUZ","CHOQUE","PERDIDA CONTROL",0,0,2
2015-06-30 10:43:00,"SUR 1","AV. DEL BOSQUE Y LAGUNA NORTE","TORREON JARDIN",,"CHOQUE","CORTE CIRCULACION",0,0,2
2015-06-30 13:54:00,"CENTRO 1ER CUADRO","AV. ALLENDE Y CALLE GALEANA","CENTRO","EL TERCER VEHICULO ESTABA ESTACIONADO","CHOQUE","NO RESPETAR SEÑAL ALTO",0,0,3
2015-06-30 17:03:00,"CENTRO 4TO CUADRO","CALZ. SALVADOR CREEL Y PRIVADA IRMA","AMPLIACION LAS MARGARITAS","SI LO ATENDIO PERITOS, NO PASO DATOS ","CHOQUE","CORTE CIRCULACION",0,0,0
2015-06-30 17:12:00,"ORIENTE 1","CALZ. XOCHIMILCO Y AV. ROVIROSA WADE","NUEVA CALIFORNIA",,"CHOQUE","NO RESPETAR SEÑAL ALTO",0,0,2
2015-06-30 17:30:00,"SUR 1","CALLE CITLALTEPEC Y CALLE JAZMINES","TORREON JARDIN","AL LESIONADO LO TRASLADARON A LA CLINICA 16, SE DESCONOCE LA EDAD","CHOQUE","CORTE CIRCULACION",1,0,2
2015-06-30 18:19:00,"CENTRO 4TO CUADRO","AUTOPISTA TORREON SAN PEDRO PUENTE LA IBERO","RESIDENCIAL IBERO",,"CHOQUE","EBRIEDAD",0,0,2
2015-06-30 18:46:00,"CENTRO 2DO CUADRO","AV. CORREGIDORA Y CALLE 12","CENTRO",,"CHOQUE","NO RESPETAR DISTANCIA",0,0,2
2015-06-30 18:57:00,"CENTRO 3ER CUADRO","BLVD. REVOLUCION Y CALZ. CUAUHTEMOC","CENTRO",,"CARAMBOLA","NO RESPETAR DISTANCIA",0,0,5
2015-06-30 18:58:00,"SUR 2","AV. PAVO REAL Y CALLE GAVIOTAS","RINCON AURORA","PASAJERA DEL TAXI LESIONES LEVES","CHOQUE","NO RESPETAR SEÑAL ALTO",1,0,2
2015-06-30 19:54:00,"CENTRO 1ER CUADRO","AV. MATAMOROS Y CALLE RAMON CORONA","CENTRO",,"CHOQUE","CORTE CIRCULACION",0,0,2
2015-06-30 23:50:00,"ORIENTE 1","CALZ. LAS PALMAS Y CALZ. AVILA CAMACHO","SANTA MARIA",,"CHOQUE","CORTE CIRCULACION",0,0,2
