fecha_hora,sector,ubicacion,colonia,observaciones,clasificacion,causa,lesionados,fallecidos,vehiculos_cantidad
2015-06-12 14:53:00,"CENTRO 3ER CUADRO","AV. JUAREZ Y CALLE 32","CENTRO","2 MENORES LESIONADAS DE 8 Y 2 AÑOS","CHOQUE","NO RESPETAR DISTANCIA",0,0,3
2015-06-12 16:08:00,"ORIENTE 1","BLVD. REVOLUCION Y FCO SARABIA","GUSTAVO DIAZ ORDAZ","4 PERSONAS LEVEMENTE  LESIONADAS, 1 MUJER DE 18 AÑOS Y 3 HOMBRES DE 18, 20 Y 40 AÑOS ","CHOQUE","NO RESPETAR SEÑAL ALTO",4,0,3
2015-06-12 16:15:00,"CENTRO 3ER CUADRO","AV. JUAREZ Y CALLE 22","CENTRO",,"CHOQUE","NO RESPETAR DISTANCIA",0,0,2
2015-06-12 16:54:00,"ORIENTE 2","CALLE TEPEHUANES Y CALABAZAS","CIUDAD NAZAS",,"CHOQUE","CORTE CIRCULACION",0,0,2
2015-06-12 18:05:00,"CENTRO 1ER CUADRO","CALLE GALEANA Y AV. ABASOLO","CENTRO",,"CHOQUE","NO RESPETAR SEÑAL ALTO",0,0,2
2015-06-12 22:28:00,"CENTRO 1ER CUADRO","AV. HIDALGO Y CALLE RAMOS ARIZPE","CENTRO","TURNO NOCTURNO","CHOQUE","CORTE CIRCULACION",0,0,0
2015-06-12 23:00:00,"ORIENTE 1","BLVD. INDEPENDENCIA Y CALLE RUBEN DARIO","FRESNO","TURNO NOCTURNO","CHOQUE","CORTE CIRCULACION",0,0,0
2015-06-13 09:03:00,"CENTRO 2DO CUADRO","BLVD. REVOLUCION Y CALLE EUGENIO AGUIRRE BENAVIDES","CENTRO",,"CHOQUE","NO RESPETAR DISTANCIA",0,0,2
2015-06-13 13:36:00,"SUR 1","CALLE COMONFORT Y PROL. RAUL MADERO","LUIS ECHEVERRIA","EL RESPONSABLE HUYO DEJANDO LA 83 ATROPELLANDO AL CONDUCTOR DE LA SUZUKI ","CHOQUE","NO RESPETAR DISTANCIA",1,0,2
2015-06-13 13:36:00,"SUR 1","CALLE COMONFORT Y PROL. RAUL MADERO","LUIS ECHEVERRIA","EL RESPONSABLE HUYO DEJANDO LA 83 ATROPELLANDO AL CONDUCTOR DE LA SUZUKI ","CHOQUE","NO RESPETAR DISTANCIA",1,0,2
2015-06-13 13:44:00,"SUR 2","LAGUNA SUR Y 3 CAMINOS","LAS DALIAS",,"CHOQUE","NO RESPETAR DISTANCIA",0,0,2
2015-06-13 14:01:00,"ORIENTE 1","BLVD. REVOLUCION Y CLZA. XOCHIMILCO","VILLA CALIFORNIA",,"CHOQUE","CORTE CIRCULACION",0,0,2
2015-06-13 14:52:00,"SUR 2","BLVD. RODRIGUEZ TRIANA Y PASEO DEL TECNOLOGICO","RINCON DE LA HACIENDA",,"ATROPELLADO CICLISTA","CORTE CIRCULACION",1,0,1
2015-06-13 15:17:00,"ORIENTE 2","BLVD. TORREON-MAT A LA ALTURA DEL PUENTE LA JOYA","SOL DE ORIENTE",,"CHOQUE","EXCESO DE VELOCIDAD",0,0,2
2015-06-13 15:18:00,"ORIENTE 1","AV. JUAREZ Y XOCHIMILCO","VILLA CALIFORNIA",,"CHOQUE","NO RESPETAR DISTANCIA",0,0,2
2015-06-13 15:23:00,"SUR 2","BLVD. RODRIGUEZ TRIANA Y PASEO DEL SUR","LAS JULIETAS",,"CHOQUE","EXCESO DE VELOCIDAD",0,0,2
2015-06-13 18:27:00,"CENTRO 2DO CUADRO","AV. ABASOLO Y CALLE 7","CENTRO","2 PERSONAS LESIONADAS","CHOQUE","NO RESPETAR SEÑAL ALTO",2,0,2
2015-06-14 00:00:00,"CENTRO 3ER CUADRO","AV. BRAVO Y CALZ. AGUILA NACIONAL","CENTRO","TURNO NOCTURNO, NO DEJO DATO EL COMANDANTE","CHOQUE","EXCESO DE VELOCIDAD",0,0,2
2015-06-14 01:48:00,"SUR 2","PUENTE ELEVADO DE TORREON MATAMOROS FRENTE AL PARQUE LAS AMERICAS","VALLE OTE","SE CANALIZO A LA ESTANCIA CORRESPONDIENTE INDICANDO QUE NO TIENEN UNIDADES DISPONIBLES. CANALIZANDO A PERITOS INDICANDO QUE A ELLOS NO LES CORRESPONDIA DICHA AREA. SIENDO APROX LAS 03:30 SE OPTO POR BAJAR EL VEHICULO A UN COSTADO DEL PARQUE LAS AMERICAS YA QUE LOS TRAILER DE CARGA PESADA PASABAN A ALTAS VELOCIDADES Y ASI EVITAR OTRO ACCIDENTE DE FATALES CONSECUENCIAS","CHOQUE","PERDIDA CONTROL",0,0,1
2015-06-14 07:00:00,"SUR 2","CALZ. GOMEZ MORIN Y CALZ. SALTILLO 400","RINCON LA ROSITA",,"CHOQUE","NO RESPETAR SEÑAL ALTO",0,0,2
2015-06-14 11:52:00,"CENTRO 1ER CUADRO","AV. PRESIDENTE CARRANZA Y RAMON CORONA","CENTRO",,"CHOQUE","NO RESPETAR SEÑAL ALTO",0,0,2
2015-06-14 13:45:00,"CENTRO 4TO CUADRO","BLVD. EL TAJITO Y PERIFERICO EN LA GASOLINERA","EJIDO EL TAJITO","SE LE INDICO FORMA DE PROCEDER A PARTE AFECTADA YA QUE EL RESPONSABLE SE DIO A LA HUIDA","CHOQUE","REVERSA",0,0,2
2015-06-14 14:32:00,"CENTRO 1ER CUADRO","HIDALGO Y RODRIGUEZ","CENTRO","EL SPARK SE DIO DE REVERSA Y EL TSURU NO FRENO","CHOQUE","REVERSA",0,0,2
2015-06-14 14:40:00,"ORIENTE 1","DE LA PEPENA Y CAPULLO","VILLA CALIFORNIA",,"CHOQUE","NO RESPETAR SEÑAL ALTO",0,0,2
2015-06-14 17:50:00,"CENTRO 1ER CUADRO","ALLENDE ENTRE RAMON CORONA Y GALEANA","CENTRO",,"CHOQUE","NO RESPETAR SEÑAL ALTO",0,0,2
2015-06-14 19:00:00,"ORIENTE 1","RIO GUADALQUIVIR Y RIO NAZAS","NAVARRO",,"CHOQUE","NO RESPETAR DISTANCIA",0,0,2
2015-06-14 20:20:00,"SUR 2","BLVD. RODRIGUEZ TRIANA FRENTE A ALSUPER","LAS DALIAS",,"ATROPELLADO PEATON","NO RESPETAR DISTANCIA",1,0,1
2015-06-15 01:25:00,"CENTRO 4TO CUADRO","PROL. COLON Y CALLE PEDRO FRANCO UGARTE","LOS ANGELES","26 M.P. ****** TOMO CONOCIMIENTO DEL DESCESO","CHOQUE","EXCESO DE VELOCIDAD",0,1,1
2015-06-15 10:30:00,"ORIENTE 1","CALLE TEPANECAS Y CLZA. CUITLAHUAC","SANTA MARIA",,"CHOQUE","CORTE CIRCULACION",0,0,2
2015-06-15 11:26:00,"ORIENTE 1","CALZ. ABASTOS Y CLZA. CUITLAHUAC","SANTA MARIA",,"CHOQUE","CORTE CIRCULACION",0,0,2
2015-06-15 13:45:00,"CENTRO 1ER CUADRO","CALLE LEONA VICARIO Y AV ALLENDE","CENTRO","LA UNIDAD  SE ENCONTRO EL ACCIDENTE SOBRE RUTINA Y YA SE HABIAN ARREGLADO LOS CONDUCTORES, RETIRANDOSE DEL LUGAR","CHOQUE","CORTE CIRCULACION",0,0,2
2015-06-15 13:50:00,"CENTRO 1ER CUADRO","AV. ALLENDE Y CALLE JIMENEZ","CENTRO",,"CARAMBOLA","NO RESPETAR DISTANCIA",0,0,3
2015-06-15 15:16:00,"ORIENTE 1","BLVD. INDEPENDENCIA Y RUBEN DARIO","EL FRESNO",,"CHOQUE","CORTE CIRCULACION",0,0,3
2015-06-15 17:43:00,"CENTRO 2DO CUADRO","AV. JUAREZ Y CALLE MARIANO L. ORTIZ","CENTRO",,"CHOQUE","CORTE CIRCULACION",0,0,2
2015-06-15 18:24:00,"ORIENTE 1","BLVD. DIAGONAL REFORMA Y CALZ. EALY ORTIZ","MOCTEZUMA","CICLISTA ****** DE ** AÑOS","CAIDA DE PERSONAS","PERDIDA CONTROL",0,0,0
2015-06-15 18:52:00,"SUR 1","CALLE CIPRESES Y CALLE TULIPANES","TORREON JARDIN","AMBULANCIA DE EMS-02 PARE CHECAR CONDUCTORA EMBARAZADA","CHOQUE","CORTE CIRCULACION",1,0,2
2015-06-15 19:55:00,"CENTRO 2DO CUADRO","AV. VICTORIA Y CALLE COMONFORT","CENTRO","LOS CONDUCTORES SE ARREGLARON VEHICULO ESTABA ESTACIONADO","CHOQUE","NO RESPETAR DISTANCIA",0,0,0
2015-06-15 19:57:00,"CENTRO 4TO CUADRO","PERIFERICO Y TAJITO","LAGUNA NORTE",,"CHOQUE","CORTE CIRCULACION",0,0,2
2015-06-15 22:30:00,"CENTRO 3ER CUADRO","AGUILA NACIONAL Y CALLE 22","CENTRO","PERCANCE ATENDIDO EN TURNO NOCTURNO","CHOQUE","NO RESPETAR SEÑAL ALTO",0,0,2
2015-06-16 01:00:00,"SUR 2","BLVD. TORR-MAT Y PERIFERICO","PEQUEÑA ZONA INDUSTRIAL",,"CHOQUE","PERDIDA CONTROL",0,0,1
2015-06-16 07:19:00,"CENTRO 2DO CUADRO","BLVD. INDEPENDENCIA Y VICTORIA","CENTRO",,"CHOQUE","CORTE CIRCULACION",1,0,2
2015-06-16 07:53:00,"SUR 2","BLVD. RODRIGUZ TRIANA Y BLVD. REVOLUCION","PLAZA JUMBO",,"CHOQUE","EXCESO DE VELOCIDAD",0,0,2
2015-06-16 08:05:00,"SUR 2","PASEO DE LA SOLEDAD Y PASEO DEL TECNOLOGICO","RESIDENCIAL TECNOLOGICO",,"CHOQUE","CORTE CIRCULACION",0,0,2
2015-06-16 08:34:00,"ORIENTE 1","AV. JUAREZ Y BLVD LAS TORRES","LAS TORRES",,"ATROPELLADO CICLISTA","CORTE CIRCULACION",1,0,1
2015-06-16 08:38:00,"ORIENTE 1","AV. XOCHIMILCO Y CALZ. RAMON MENDEZ","FRANCISCO VILLA",,"CHOQUE","CORTE CIRCULACION",0,0,2
2015-06-16 09:48:00,"CENTRO 4TO CUADRO","AV. SERTOMA Y BLVD. INDEPENDENCIA","SAN ISIDRO",,"CHOQUE","NO RESPETAR DISTANCIA",0,0,2
2015-06-16 10:03:00,"CENTRO 3ER CUADRO","BLVD. REVOLUCION Y CALLE 18","CENTRO",,"CHOQUE","CORTE CIRCULACION",0,0,2
2015-06-16 11:50:00,"CENTRO 1ER CUADRO","CALZ. COLON Y AV. BRAVO","CENTRO",,"CHOQUE","NO RESPETAR DISTANCIA",0,0,2
2015-06-16 12:00:00,"SUR 2","CALLE PELTRES Y AV. FUNDADORES","MANHATAN",,"CHOQUE","NO RESPETAR SEÑAL ALTO",0,0,2
2015-06-16 13:23:00,"CENTRO 2DO CUADRO","AV. MORELOS Y CALLE 24","CENTRO",,"CHOQUE","CORTE CIRCULACION",0,0,2
2015-06-16 13:49:00,"CENTRO 3ER CUADRO","CALZ. CUAUHTEMOC Y AV JUAREZ","CENTRO",,"CHOQUE","CORTE CIRCULACION",0,0,2
2015-06-16 13:54:00,"SUR 1","PASEO CENTRAL Y CALLE JAZMINEZ","TORREON JARDIN","NO PASO MAS DATOS DE 56 Y 60 87 NECTAR DEL CONDUCTOR","CHOQUE","CORTE CIRCULACION",0,0,2
2015-06-16 14:20:00,"SUR 2","CALLE TURIN Y AV.  TOLOSA ","CASA BLANCA",,"CHOQUE","NO RESPETAR SEÑAL ALTO",0,0,2
2015-06-16 16:14:00,"CENTRO 2DO CUADRO","AV. HIDALGO Y CALLE FRANCISCO I. MADERO","CENTRO",,"CHOQUE","NO RESPETAR SEÑAL ALTO",0,0,2
2015-06-16 16:17:00,"CENTRO 1ER CUADRO","AV. HIDALGO Y CALLE JIMENEZ","CENTRO","LESIONADO ******","CHOQUE","CORTE CIRCULACION",1,0,2
2015-06-16 16:27:00,"CENTRO 2DO CUADRO","AV. LERDO DE TEJADA Y CALLE 9","CENTRO","PRESUNTO RESPONSABLE SE DIO A LA HUIDA DEJANDO LA 83 ABANDONADA","CHOQUE","NO RESPETAR SEÑAL ALTO",1,0,2
2015-06-16 17:10:00,"ORIENTE 1","CALZ. RAMON MENDEZ Y AV. DE LA PAZ","MOCTEZUMA","ATROPELLADO ****** DE ** AÑOS, PERSONA FALLECIO EN EL TRASLADO, INFORMA JEFE DE PERITOS","ATROPELLADO PEATON","CORTE CIRCULACION",0,1,2
2015-06-16 18:21:00,"CENTRO 2DO CUADRO","BLVD. REVOLUCION Y CALLE 11","CENTRO","60 DERRAPO NO ACEPTO ATENCION MEDICA","CAIDA DE PERSONAS","PERDIDA CONTROL",0,0,1
2015-06-16 18:57:00,"CENTRO 4TO CUADRO","BLVD. INDEPENDENCIA Y CALLE FELICIANO COBIAN","LOS ANGELES ","ACOMPAÑANTE DEL 60 TAMBIEN RESULTO LESIONADO  AMBOS CON HERIDAS LEVES","CHOQUE","NO RESPETAR SEÑAL ALTO",2,0,2
2015-06-16 19:08:00,"ORIENTE 1","PERIFERICO Y ANTIGUA CARRTERA  SAN PEDRO","EJIDO IGNACIO ALLENDE",,"CHOQUE","NO RESPETAR DISTANCIA",0,0,2
2015-06-16 20:10:00,"SUR 2","PASEO DEL TECNOLOGICO Y CALLE CICILIA","TORREON RESIDENCIAL","LA 83 ESTABA ESTACIONADA","CHOQUE","PERDIDA CONTROL",0,0,2
2015-06-16 20:18:00,"CENTRO 3ER CUADRO","BLVD. DIAGONAL REFORMA Y AV. JUAREZ","JARDINES REFORMA",,"CHOQUE","NO RESPETAR DISTANCIA",0,0,2
2015-06-16 20:25:00,"SUR 1","PASEO DEL OLIMPO Y CALZ. SALTILLO 400","CAMPESTRE LA ROSITA","****** INDICA QUE SOLO DATOS POR WISKI PARA NO CONGESTIONAR EL MEDIO","CHOQUE","CORTE CIRCULACION",0,0,0
2015-06-17 08:19:00,"ORIENTE 1","EJIDO FLORES MAGON POR TSM","EJIDO FLORES MAGON","60 DERRAPO","CAIDA DE PERSONAS","PERDIDA CONTROL",0,0,0
2015-06-17 08:28:00,"CENTRO 4TO CUADRO","EJIDO LA UNION POR ESCUADRON 201 A LA ALTURA DE LOS LLANOS","EJIDO LA UNION","RESPONSABLE SE DIO A LA HUIDA, LESIONADO DE NOMBRE ****** DE ** AÑOS","ATROPELLADO PEATON","NO RESPETAR DISTANCIA",1,0,0
2015-06-17 08:46:00,"CENTRO 1ER CUADRO","BLVD. REVOLUCION Y CALLE JUAN ANTONIO DE LA FUENTE","CENTRO",,"CHOQUE","CORTE CIRCULACION",0,0,2
2015-06-17 08:48:00,"ORIENTE 1","CARRETERA A SAN PEDRO EJIDO ANA FRENTE A ESC. PRIMARIA LAZARO CARDENAS","EJIDO ANA","NIÑA DE NOMBRE ****** LEVEMENTE LESIONADA","CHOQUE","CORTE CIRCULACION",1,0,2
2015-06-17 08:58:00,"CENTRO 4TO CUADRO","BLVD. CONSTITUCION Y CALZ. SALVADOR CREEL","LAS MARGARITAS",,"CHOQUE","NO RESPETAR DISTANCIA",0,0,2
2015-06-17 14:25:00,"SUR 2","CALLE CADIZ Y CALLE PAVORREAL","CASA BLANCA",,"CHOQUE","NO RESPETAR SEÑAL ALTO",0,0,2
2015-06-17 14:30:00,"CENTRO 1ER CUADRO","AV. HIDALGO Y CALLE GALEANA","CENTRO","SOLO LO ATENDIO 29´S YA QUE PROCEDIERON POR 39 A OMEGA","CHOQUE","CORTE CIRCULACION",0,0,0
2015-06-17 15:17:00,"ORIENTE 1","CALZ. ROVIROSA WADE Y AV. BRAVO","NUEVA CALIFORNIA",,"ATROPELLADO CICLISTA","SENTIDO CONTRARIO",0,0,2
2015-06-17 15:41:00,"CENTRO 3ER CUADRO","AV. HIDALGO Y CALLE MATIAS ROMAN","CENTRO",,"CHOQUE","NO RESPETAR SEÑAL ALTO",0,0,3
2015-06-17 15:43:00,"ORIENTE 1","AV. OCAMPO Y CALLE JULIO RODRIGUEZ SANCHEZ","NUEVO TORREON",,"CHOQUE","NO RESPETAR SEÑAL ALTO",0,0,2
2015-06-17 15:51:00,"ORIENTE 2","PERIFERICO A LA ALTURA DEL HOTEL HAMPTON INN","VIÑEDOS","RESPONSABLE HUYO","CHOQUE","CORTE CIRCULACION",0,0,2
2015-06-17 16:00:00,"CENTRO 1ER CUADRO","BLVD REVOLUCION Y CALLE VIESCA","CENTRO","PENDIENTE DATOS RT METRO","CHOQUE","CORTE CIRCULACION",0,0,0
2015-06-17 16:13:00,"CENTRO 4TO CUADRO","BLVD. INDEPENDENCIA Y CALLE SERTOMA","NUEVA LOS ANGELES ","PENDIENTE DATOS RT MILENIO","CHOQUE","CORTE CIRCULACION",0,0,0
2015-06-17 17:00:00,"ORIENTE 1","PERIFERICO A LA ALTURA PUENTE VALLE VERDE","VALLE VERDE",,"CHOQUE","CORTE CIRCULACION",0,0,2
2015-06-17 17:52:00,"ORIENTE 1","AV. BRAVO Y CALZ.  RAMON MENDEZ","SAN MARCOS",,"CHOQUE","REVERSA",0,0,2
2015-06-17 21:50:00,"CENTRO 1ER CUADRO","CALLE RAMON CORONA Y AV. ABASOLO","CENTRO","PERCANCE ATENDIDO EN TURNO NOCTURNO","CHOQUE","CORTE CIRCULACION",0,0,0
2015-06-18 00:00:00,"ORIENTE 1","BLVD. TORREON MATAMOROS Y CALLE 51","HORIZONTE","PERCANSE ATENDIDO DESPUES DEL TURNO DE OMEGA","CHOQUE","CORTE CIRCULACION",0,0,0
2015-06-18 06:10:00,"CENTRO 4TO CUADRO","PROLONGACION CUAUHTEMOC","SAN ISIDRO","PERCANCE ATENDIDO EN TURNO NOCTURNO","CHOQUE","EBRIEDAD",0,0,1
2015-06-18 08:09:00,"CENTRO 2DO CUADRO","BLVD. REVOLUCION Y CALLE 12","CENTRO",,"CHOQUE","CORTE CIRCULACION",0,0,2
2015-06-18 08:42:00,"CENTRO 2DO CUADRO","CALLE CUAUHTEMOC Y AV. ALVAREZ","CENTRO",,"CHOQUE","NO RESPETAR SEÑAL ALTO",0,0,2
2015-06-18 13:05:00,"ORIENTE 2","CARRETERA A SANTA FE Y PERIFERICO","EJIDO SAN LUIS",,"CHOQUE","NO RESPETAR DISTANCIA",0,0,2
2015-06-18 13:16:00,"ORIENTE 1","BLVD. TORREON MATAMOROS Y CALLE 60","HORIZONTE",,"CHOQUE","NO RESPETAR DISTANCIA",0,0,2
2015-06-18 13:31:00,"ORIENTE 1","CALZ. AVILA CAMACHO Y CALLE RIO AMAZONAS","NAVARRO",,"CHOQUE","CORTE CIRCULACION",0,0,2
2015-06-18 14:00:00,"CENTRO 4TO CUADRO","CALLE MEXICO Y CALLE SALTILLO","SAN ISIDRO","RESPONSABLE HUYO, NO PASO DATOS DEL 60","CHOQUE","CORTE CIRCULACION",0,0,0
2015-06-18 14:05:00,"ORIENTE 1","BLVD. REVOLUCION Y CALLE BELGICA","NVA. CALIFORNIA",,"CHOQUE","NO RESPETAR SEÑAL ALTO",0,0,0
2015-06-18 14:59:00,"SUR 2","BLVD. RDZ TRIANA Y CALZ. GOMEZ MORIN","CLUB MAGISTERIO",,"CHOQUE","CORTE CIRCULACION",0,0,2
2015-06-18 16:10:00,"CENTRO 1ER CUADRO","AV. MORELOS Y CALLE LEONA VICARIO","CENTRO",,"CHOQUE","CORTE CIRCULACION",0,0,0
2015-06-18 19:47:00,"CENTRO 3ER CUADRO","AV. MORELOS Y CALLE C.32","CENTRO","87 DE LESIONADOS","CHOQUE","CORTE CIRCULACION",0,0,0
2015-06-18 20:04:00,"ORIENTE 1","BLVD. DIAGONAL REFORMA Y CALZ. AVILA CAMACHO","NAVARRO","60 DERRAPO A CAUSA DE LA LLUVIA","CAIDA DE PERSONAS","PERDIDA CONTROL",0,0,1
2015-06-18 20:50:00,"SUR 2","NORIA Y DIVISION DEL NORTE","RESIDENCIAL LA HACIENDA",,"CHOQUE","CORTE CIRCULACION",0,0,0
2015-06-19 00:00:00,"ORIENTE 1","BLVD. DIAGONAL REFORMA Y CALZ. ABASTOS","ABASTOS","PERCANCE ATENDIDO EN TURNO NOCTURNO, RESPONSABLE SE DA A LA HUIDA, ****** DE ** AÑOS CON LESIONES LEVES","ATROPELLADO PEATON","NO RESPETAR DISTANCIA",0,0,0
2015-06-19 00:50:00,"CENTRO 3ER CUADRO","CALLE CUAUHTEMOC Y AV. CORREGIDORA","CENTRO","PERCANCE ATENDIDO EN TURNO NOCTURNO.","CHOQUE","SEMAFORO",0,0,2
2015-06-19 02:10:00,"CENTRO 3ER CUADRO","BLVD. REVOLUCION Y BLVD. DIAGONAL REFORMA","CENTRO",,"CHOQUE","NO RESPETAR SEÑAL ALTO",2,0,2
2015-06-19 09:05:00,"CENTRO 3ER CUADRO","BLVD. REVOLUCION Y CALLE 22","CENTRO",,"CHOQUE","PERDIDA CONTROL",0,0,2
2015-06-19 10:09:00,"CENTRO 4TO CUADRO","BLVD. INDEPENDENCIA Y CALZ. ABASTOS","NUEVO SAN ISIDRO",,"CHOQUE","CORTE CIRCULACION",0,0,2
2015-06-19 10:10:00,"CENTRO 3ER CUADRO","AV. ABASOLO Y CALLE 22","CENTRO",,"CHOQUE","CORTE CIRCULACION",0,0,2
2015-06-19 13:34:00,"SUR 2","BLVD. TORREON MATAMOROS Y BLVD. RODRIGUEZ TRIANA ","PLAZA JUMBO",,"CHOQUE","CORTE CIRCULACION",0,0,2
2015-06-19 13:46:00,"NORTE","PROLONGACION COMONFORT Y METALURGICA","METALURGICA","SE ESTAMPA CONTRA BARDA DE PEÑOLES, PIERDE CONTROL POR LA VELOCIDAD EN CURVA, CONDUCTOR CON GOLPES EN EL PECHO ","CHOQUE","EXCESO DE VELOCIDAD",1,0,1
2015-06-19 14:21:00,"CENTRO 4TO CUADRO","BLVD. INDEPENDENCIA Y CALLE ZACATECAS","SAN ISIDRO",,"CHOQUE","CORTE CIRCULACION",0,0,2
2015-06-19 14:32:00,"CENTRO 3ER CUADRO","AV. JUAREZ Y CALZ. CUAUHTEMOC","CENTRO",,"CHOQUE","NO RESPETAR DISTANCIA",0,0,2
2015-06-19 14:47:00,"ORIENTE 1","AV. BRAVO Y CALZ. ROVIROSA WADE","VILLA CALIFORNIA",,"CHOQUE","NO RESPETAR DISTANCIA",0,0,2
2015-06-19 15:08:00,"SUR 2","BLVD. LAGUNA SUR FRENTE A LAS DALIAS","LAS DALIAS","PERSONA FALLECIDA DE NOMBRE ******, MINISTERIO PUBLICO ****** Y ******, SEMEFO FUNERALES ******","ATROPELLADO PEATON","PERDIDA CONTROL",0,1,1
2015-06-19 15:13:00,"SUR 1","BLVD. RODRIGUEZ TRIANA A LA ALTURA DE SUMITOMO","IMPULSO COMUNAL",,"CHOQUE","NO RESPETAR DISTANCIA",1,0,2
2015-06-19 16:17:00,"ORIENTE 1","CAL. ABASTOS Y BLVD. INDEPENDENCIA","ESTRELLA",,"CARAMBOLA","NO RESPETAR DISTANCIA",0,0,3
2015-06-19 17:18:00,"SUR 2","CALZ. FUNDADORES DE TORREON Y PASEO DEL TECNOLOGICO","RESIDENCIAL DEL NORTE",,"CHOQUE","VUELTA INDEBIDA",0,0,2
2015-06-19 17:45:00,"ORIENTE 1","CALZ. MEXICO Y BLVD. REVOLUCION","FELIPE ANGELES ",,"CHOQUE","CORTE CIRCULACION",0,0,2
2015-06-19 18:37:00,"CENTRO 1ER CUADRO","AV. JUAREZ Y CALLE GALEANA","CENTRO",,"CHOQUE","CORTE CIRCULACION",0,0,0
2015-06-19 18:52:00,"SUR 2","CALZ. FRANCISCO SARABIA Y CALZ. SECCION 38","AMPLIACION SECCION  38","RESPONSABLE SE DIO A LA HUIDA","CHOQUE","CORTE CIRCULACION",1,0,2
2015-06-19 20:14:00,"SUR 2","CALZ. VASCONCELOS Y CALZ. PAVO REAL","PROVITEC","60 DERRAPO, ACOMPAÑANTE ****** DE ** AÑOS","CAIDA DE PERSONAS","PERDIDA CONTROL",2,0,1
2015-06-19 20:23:00,"CENTRO 2DO CUADRO","AV. ARISTA Y CALLE 12","CENTRO",,"CHOQUE","CORTE CIRCULACION",0,0,2
2015-06-19 22:30:00,"SUR 2","BLVD. REVOLUCION Y CALLE GAVIOTAS","ANTIGUA LOS ANGELES",,"CHOQUE","NO RESPETAR DISTANCIA",0,0,2
2015-06-19 23:50:00,"CENTRO 4TO CUADRO","PUENTE DE LA IBERO","AUTOPISTA A SAN PEDRO",,"CHOQUE","EBRIEDAD",0,0,1
2015-06-20 00:30:00,"CENTRO 3ER CUADRO","AV. JUAREZ Y CALLE 26","CENTRO",,"CHOQUE","NO RESPETAR SEÑAL ALTO",0,0,2
2015-06-20 02:15:00,"CENTRO 3ER CUADRO","CALLE CUAUHTEMOC Y AV. ARTES GRAFICAS","CENTRO",,"CHOQUE","EBRIEDAD",0,0,2
2015-06-20 07:27:00,"CENTRO 2DO CUADRO","BLVD. REVOLUCION Y CALLE GREGORIO A. GARCIA","CENTRO",,"CHOQUE","NO RESPETAR DISTANCIA",0,0,2
2015-06-20 10:00:00,"ORIENTE 2","PERIFERICO Y BLVD. DE LA AMISTAD ","AMISTAD",,"CHOQUE","NO RESPETAR DISTANCIA",0,0,2
2015-06-20 14:17:00,"CENTRO 3ER CUADRO","AV. JUAREZ Y CALLE 30","CENTRO",,"CHOQUE","NO RESPETAR DISTANCIA",0,0,2
2015-06-20 15:42:00,"CENTRO 2DO CUADRO","CALZ. AVILA CAMACHO Y CALLE 12","CENTRO",,"CHOQUE","CORTE CIRCULACION",0,0,2
2015-06-20 17:11:00,"SUR 2","CARRETERA MIELERAS FRENTE AL PARQUE INDUSTRIAL LAS AMERICAS","PARQUE INDUSTRIAL ORIENTE","LESIONADA ****** DE ** AÑOS","CARAMBOLA","NO RESPETAR DISTANCIA",2,0,4
2015-06-20 17:51:00,"ORIENTE 1","BLVD. LAS TORRES Y CALLE TORRE LATINO","LAS TORRES",,"CHOQUE","EBRIEDAD",0,0,2
2015-06-20 22:00:00,"SUR 2","BUGAMBILIAS Y VIOLETAS","LAS DALIAS",,"CHOQUE","EBRIEDAD",0,0,0
2015-06-20 22:55:00,"SUR 2","BLVD. RDZ TRIANA Y AV. UNIVERSIDAD","EMILIANO ZAPATA","RESPONSABLE SE DIO A LA HUIDA","ATROPELLADO PEATON","EXCESO DE VELOCIDAD",0,0,0
2015-06-21 00:40:00,"ORIENTE 1","CALLE 36 Y AV. MATAMOROS","NUEVO TORREON",,"CHOQUE","CORTE CIRCULACION",0,0,0
2015-06-21 01:30:00,"CENTRO 2DO CUADRO","AV. BRAVO Y CALLE 12","CENTRO",,"CHOQUE","EBRIEDAD",0,0,0
2015-06-21 02:10:00,"CENTRO 2DO CUADRO","AV. JUAREZ Y CALLE 8","CENTRO",,"CHOQUE","EBRIEDAD",0,0,0
2015-06-21 03:20:00,"ORIENTE 2","CARRETERA A SANTA FE Y PERIFERICO","EJIDO SAN LUISITO",,"CHOQUE","CORTE CIRCULACION",0,0,0
2015-06-21 06:00:00,"ORIENTE 1","CALZ. RAMON MENDEZ Y AV. ALDAMA","NUEVO TORREON",,"CHOQUE","CORTE CIRCULACION",0,0,0
2015-06-21 10:30:00,"ORIENTE 2","TORREON MATAMOROS A LA ALTURA DEL 33 BATALLON","OSCAR FLORES TAPIA",,"CHOQUE","CORTE CIRCULACION",0,0,2
2015-06-21 12:10:00,"ORIENTE 1","CALZ. CUITLAHUAC Y AZCAPOTZALCO","CAROLINAS",,"CHOQUE","CORTE CIRCULACION",1,0,2
2015-06-21 12:35:00,"ORIENTE 2","CARRETERA A SANTA FE A LA ALTURA DEL KM 2","FRACC LA NORIA",,"CHOQUE","CORTE CIRCULACION",1,0,2
2015-06-21 14:20:00,"CENTRO 3ER CUADRO","AV. GUERRERO Y CALZ. CUAUHTEMOC","CENTRO",,"CHOQUE","PERDIDA CONTROL",1,0,2
2015-06-21 14:50:00,"CENTRO 2DO CUADRO","GONZALEZ ORTEGA Y AV. JUAREZ","CENTRO",,"CHOQUE","CORTE CIRCULACION",0,0,2
2015-06-21 15:25:00,"CENTRO 4TO CUADRO","AMADOR CARDENAS Y ONCEAVA","NUEVA LOS ANGELES",,"CHOQUE","NO RESPETAR SEÑAL ALTO",3,0,2
2015-06-21 18:50:00,"SUR 2","CALZ. VALLE OTE Y HUASTECA","VALLE ORIENTE","6 MENORES LESIONADO DE ENTRE 2 A 5 AÑOS","CHOQUE","NO RESPETAR DISTANCIA",6,0,2
2015-06-21 19:30:00,"SUR 2","BLVD. REVOLUCION POR LA AGENCIA CORONA","NUEVA CORONA",,"CHOQUE","NO RESPETAR DISTANCIA",1,0,3
2015-06-22 08:01:00,"ORIENTE 1","BLVD. DIAGONAL REFORMA Y CALLE 35","NUEVO TORREON","OMITEN NOMBRES","CHOQUE","CORTE CIRCULACION",0,0,2
2015-06-22 09:23:00,"ORIENTE 1","BLVD. INDEPENDENCIA Y CALLE RUBEN DARIO","EL FRESNO ","AL PARECER RESPONSABLE HUYO","CHOQUE","NO RESPETAR SEÑAL ALTO",0,0,2
2015-06-22 09:36:00,"CENTRO 3ER CUADRO","CALZ. AVILA CAMACHO Y CALZ. CUAUHTEMOC","CENTRO",,"CHOQUE","NO RESPETAR DISTANCIA",0,0,3
2015-06-22 13:55:00,"CENTRO 4TO CUADRO","BLVD. INDEPENDENCIA Y CALLE FELICIANO COBIAN","LOS ANGELES",,"CHOQUE","SENTIDO CONTRARIO",1,0,2
2015-06-22 16:39:00,"CENTRO 2DO CUADRO","AV. PTE. CARRANZA Y CALLE FRANCISCO I MADERO","CENTRO",,"CHOQUE","NO RESPETAR DISTANCIA",0,0,2
2015-06-22 17:20:00,"CENTRO 1ER CUADRO","CALLE JUAN ANTONIO DE LA FUENTE Y AV. PTE CARRANZA","CENTRO",,"CHOQUE","NO RESPETAR DISTANCIA",0,0,2
2015-06-22 19:41:00,"SUR 2","AV. MANUEL GOMEZ MORIN Y CALLE TURIN","TORREON RECIDENCIAL","****** DE ** AÑOS LESIONADA","CHOQUE","CORTE CIRCULACION",1,0,2
2015-06-23 06:45:00,"ORIENTE 1","AV. BRAVO Y CALZ. ROVIROSA WADE","VILLA CALIFORNIA",,"CHOQUE","NO RESPETAR DISTANCIA",0,0,2
2015-06-23 06:55:00,"CENTRO 3ER CUADRO","BLVD. DIAGONAL REFORMA Y CALLE CORREGIDORA","CENTRO","TURNO NOCTURNO","CHOQUE","CORTE CIRCULACION",1,0,2
2015-06-23 08:28:00,"ORIENTE 1","BLVD. DIAGONAL REFORMA Y CALLE TEPANECAS","SANTA MARIA","LESIONADA ****** DE ** AÑOS","CHOQUE","NO RESPETAR SEÑAL ALTO",1,0,2
2015-06-23 10:52:00,"ORIENTE 1","BLVD. INDEPENDENCIA Y RIO SUCHIATE","ESTRELLA",,"CHOQUE","CORTE CIRCULACION",0,0,2
2015-06-23 13:29:00,"CENTRO 3ER CUADRO","AV. ZACATECAS Y CALZ. CUAUHTEMOC","CENTRO","POR LA ALTURA DEL CAMION DERRIBO CABLES CFE","CHOQUE","PERDIDA CONTROL",0,0,1
2015-06-23 13:50:00,"SUR 1","CALLE SICOMOROS Y CALLE DURAZNO","TORREON JARDIN",,"CHOQUE","CORTE CIRCULACION",0,0,2
2015-06-23 17:00:00,"SUR 1","CALLE SICOMOROS Y CALLE TEJOCOTES","TORREON JARDIN",,"CHOQUE","NO RESPETAR DISTANCIA",0,0,2
2015-06-23 17:05:00,"CENTRO 4TO CUADRO","BLVD. INDEPENDENCIA Y CALLE FELICIANO COBIAN","LOS ANGELES",,"CHOQUE","NO RESPETAR DISTANCIA",0,0,2
2015-06-23 19:42:00,"CENTRO 3ER CUADRO","AV. MATAMOROS Y CALZ JUAMBELZ","CENTRO",,"CHOQUE","NO RESPETAR DISTANCIA",0,0,2
2015-06-23 19:45:00,"ORIENTE 1","BLVD. JUAN AGUSTIN DE ESPINOZA Y BLVD DE LOS GRANDES PINTORES","QUINTAS SAN ANTONIO",,"CHOQUE","NO RESPETAR DISTANCIA",0,0,2
2015-06-23 20:04:00,"ORIENTE 2","NUEVO PERIFERICO","SOL DE ORIENTE","LESIONADOS ****** DE ** AÑOS, ******, ****** Y 3 MENORES 87 DE DATOS","CHOQUE","CORTE CIRCULACION",3,0,2
2015-06-24 10:37:00,"ORIENTE 2","ANTIGUA CARRETERA A SAN  PEDRO Y CALLE SALVADOR JALIFE","ZONA INDUSTRIAL ORIENTE","OMITIERON NOMBRES","CHOQUE","CORTE CIRCULACION",0,0,2
2015-06-24 11:23:00,"CENTRO 3ER CUADRO","AV. CARRANZA Y CALLE 24","CENTRO","LESIONADOS, LA CONDUCTORA DEL I10 Y ****** DE ** AÑOS","CHOQUE","NO RESPETAR SEÑAL ALTO",2,0,2
2015-06-24 13:02:00,"CENTRO 1ER CUADRO","AV. HIDALGO Y JUAN ANTONIO DE LA FUENTE","CENTRO","56 STRATUS ESTABA ESTACIONADO","CHOQUE","PERDIDA CONTROL",0,0,2
2015-06-24 13:50:00,"CENTRO 1ER CUADRO","AV. PRESIDENTE CARRANZA Y CALLE J.A. DE LA FUENTE","CENTRO",,"CHOQUE","CORTE CIRCULACION",0,0,2
2015-06-24 14:00:00,"SUR 1","PASEO CENTRAL Y CALLE MONTE FRIO","VALLE DORADO",,"CHOQUE","NO RESPETAR SEÑAL ALTO",0,0,2
2015-06-24 15:45:00,"CENTRO 1ER CUADRO","AV. JUAREZ Y CALLE CEPEDA","CENTRO",,"CHOQUE","CORTE CIRCULACION",1,0,3
2015-06-24 16:03:00,"CENTRO 1ER CUADRO","CALLE RODRIGUEZ Y AV. ALLENDE","CENTRO",,"CARAMBOLA","SEMAFORO",0,0,2
2015-06-24 19:28:00,"SUR 2","CARRETERA TORREON MATAMOROS Y CALZ. VALLE ORIENTE","VALLE ORIENTE",,"ATROPELLADO PEATON","EXCESO DE VELOCIDAD",0,1,1
2015-06-24 19:30:00,"CENTRO 2DO CUADRO","BLVD. INDEPENDENCIA Y CALLE 12","CENTRO","DATOS DEL REPORTE BRAVO TORMENTA","CHOQUE","CORTE CIRCULACION",0,0,0
2015-06-24 19:40:00,"ORIENTE 1","BLVD. DIAGONAL REFORMA Y PROLONGACION ZACATECAS","ABASTOS","DATOS DEL REPORTE BRAVO TORMENTA","CHOQUE","CORTE CIRCULACION",0,0,0
2015-06-25 01:30:00,"CENTRO 4TO CUADRO","BLVD. INDEPENDENCIA Y CALLE MONACO","SAN ISIDRO","TURNO NOCTURNO","CHOQUE","SEMAFORO",0,0,2
2015-06-25 05:45:00,"SUR 2","CARRETERA A MIELERAS Y CALZ. GOMEZ MORIN","MONTEBELLO","5 PERSONAS FALLECIDAS EN EL LUGAR, DOS MAS EN EL HOSPITAL","CHOQUE","EXCESO DE VELOCIDAD",0,7,2
2015-06-25 07:32:00,"ORIENTE 2","PERIFERICO Y AV. JUAREZ","ARBOLEDAS",,"CHOQUE","CORTE CIRCULACION",0,0,2
2015-06-25 09:22:00,"SUR 2","BLVD. TORREON MATAMOROS Y CALZ. DIVISION DEL NORTE","PROVITEC",,"CHOQUE","NO RESPETAR DISTANCIA",0,0,2
2015-06-25 09:45:00,"CENTRO 1ER CUADRO","BLVD. INDEPENDENCIA Y CALLE JIMENEZ","CENTRO",,"CHOQUE","NO RESPETAR SEÑAL ALTO",0,0,2
2015-06-25 10:13:00,"ORIENTE 1","CALZ. ABASTOS Y RIO SABINAS","ESTRELLA"," ","CHOQUE","CORTE CIRCULACION",1,0,2
2015-06-25 10:21:00,"SUR 2","CALLE TURIN Y MAR DE CORTES","TORREON RESIDENCIAL",,"CHOQUE","NO RESPETAR SEÑAL ALTO",0,0,2
2015-06-25 11:52:00,"ORIENTE 1","BLVD. INDEPENDENCIA FRENTE AL TONY ROMA´S","FRESNO","LESIONADO FALLECE EN ELHOSPITAL DESPUES DE 5 DIAS ","CHOQUE","CORTE CIRCULACION",1,0,2
2015-06-25 12:49:00,"CENTRO 3ER CUADRO","AV. PRESIDENTE CARRANZA Y CALZ. CUAHTEMOC","CENTRO","TRAILER ROMPE CABLES","CHOQUE","ESTRUCTURAS Y SEÑALAMIENTOS URBANOS",0,0,1
2015-06-25 13:05:00,"CENTRO 1ER CUADRO","AV. MATAMOROS Y CALLE ILDEFONSO FUENTES","CENTRO",,"CHOQUE","PERDIDA CONTROL",0,0,4
2015-06-25 13:15:00,"ORIENTE 1","CALLE IZTACALCO Y CALLE XICOTENCATL","CAROLINAS",,"CHOQUE","CORTE CIRCULACION",0,0,2
2015-06-25 17:19:00,"SUR 2","PASEO DEL TECNOLOGICO Y CALLE TURIN","LA ROSITA",,"CHOQUE","NO RESPETAR SEÑAL ALTO",0,0,2
2015-06-25 17:36:00,"SUR 2","PASEO DEL TECNOLOGICO Y CALZ. SALTILLO 400","LA ROSITA",,"CHOQUE","NO RESPETAR DISTANCIA",0,0,3
2015-06-25 17:54:00,"CENTRO 3ER CUADRO","AV. ALVAREZ ENTRE CALLE 15 Y 16","CENTRO",,"ATROPELLADO PEATON","REVERSA",1,0,1
2015-06-26 05:00:00,"ORIENTE 2","PERIFERICO Y AV. ALLENDE","ARBOLEDAS","TURNO NOCTURNO","CHOQUE","CORTE CIRCULACION",0,0,0
2015-06-26 11:00:00,"SUR 1","PASEO DE LA ROSITA Y PASEO DE LA DILIGENCIA","CAMPESTRE LA ROSITA","INVADE CARRIL","CHOQUE","CORTE CIRCULACION",0,0,2
